19:10:34.528212 IP (tos 0x0, ttl 64, id 33369, offset 0, flags [DF], proto TCP (6), length 119)
    system.52266 > 170.72.250.157.https: Flags [P.], cksum 0xfaec (correct), seq 1005399008:1005399075, ack 2856943158, win 58, options [nop,nop,TS val 341010787 ecr 2395263323], length 67
19:10:34.571812 IP (tos 0x0, ttl 55, id 51642, offset 0, flags [DF], proto TCP (6), length 89)
    170.72.250.157.https > system.52266: Flags [P.], cksum 0x577e (correct), seq 1:38, ack 0, win 168, options [nop,nop,TS val 2395278275 ecr 340995786], length 37
19:10:34.571813 IP (tos 0x0, ttl 55, id 51643, offset 0, flags [DF], proto TCP (6), length 52)
    170.72.250.157.https > system.52266: Flags [.], cksum 0x9988 (correct), ack 67, win 168, options [nop,nop,TS val 2395278276 ecr 341010787], length 0
19:10:34.572094 IP (tos 0x0, ttl 64, id 33370, offset 0, flags [DF], proto TCP (6), length 93)
    system.52266 > 170.72.250.157.https: Flags [P.], cksum 0xe07f (correct), seq 67:108, ack 38, win 58, options [nop,nop,TS val 341010831 ecr 2395278275], length 41
19:10:34.572665 IP (tos 0x0, ttl 55, id 51644, offset 0, flags [DF], proto TCP (6), length 126)
    170.72.250.157.https > system.52266: Flags [P.], cksum 0xd84a (correct), seq 38:112, ack 67, win 168, options [nop,nop,TS val 2395278277 ecr 341010787], length 74
19:10:34.573951 IP (tos 0x0, ttl 64, id 33371, offset 0, flags [DF], proto TCP (6), length 89)
    system.52266 > 170.72.250.157.https: Flags [P.], cksum 0xa2d5 (correct), seq 108:145, ack 112, win 58, options [nop,nop,TS val 341010833 ecr 2395278277], length 37
19:10:34.623657 IP (tos 0x0, ttl 55, id 51645, offset 0, flags [DF], proto TCP (6), length 52)
    170.72.250.157.https > system.52266: Flags [.], cksum 0x9897 (correct), ack 145, win 168, options [nop,nop,TS val 2395278321 ecr 341010831], length 0
19:10:34.726063 5c:e9:31:24:fe:df (oui Unknown) > Broadcast, Realtek unknown type 0x25
19:10:34.827487 ARP, Ethernet (len 6), IPv4 (len 4), Request who-has 192.168.0.34 tell _gateway, length 46
19:10:35.461611 IP (tos 0x0, ttl 64, id 46563, offset 0, flags [none], proto UDP (17), length 84)
    system.38970 > _gateway.domain: 55877+ [1au] PTR? 157.250.72.170.in-addr.arpa. (56)
19:10:35.547204 IP (tos 0x0, ttl 64, id 0, offset 0, flags [DF], proto UDP (17), length 177)
    _gateway.domain > system.38970: 55877 NXDomain 0/1/1 (149)
19:10:35.550585 IP (tos 0x0, ttl 255, id 34571, offset 0, flags [none], proto UDP (17), length 71)
    system.mdns > mdns.mcast.net.mdns: 0 PTR (QM)? 34.0.168.192.in-addr.arpa. (43)
19:10:35.618576 ARP, Ethernet (len 6), IPv4 (len 4), Request who-has 192.168.0.34 tell system, length 28
19:10:35.748864 5c:e9:31:24:fe:df (oui Unknown) > Broadcast, Realtek unknown type 0x25
19:10:35.853986 ARP, Ethernet (len 6), IPv4 (len 4), Request who-has 192.168.0.34 tell _gateway, length 46
19:10:36.591948 IP (tos 0x0, ttl 64, id 4311, offset 0, flags [DF], proto TCP (6), length 91)
    system.49730 > pv-in-f100.1e100.net.https: Flags [P.], cksum 0x32ca (correct), seq 4080245036:4080245075, ack 1063803253, win 67, options [nop,nop,TS val 22833817 ecr 112880632], length 39
19:10:36.618276 IP (tos 0x0, ttl 255, id 35283, offset 0, flags [none], proto UDP (17), length 71)
    system.mdns > mdns.mcast.net.mdns: 0 PTR (QM)? 34.0.168.192.in-addr.arpa. (43)
19:10:36.632528 ARP, Ethernet (len 6), IPv4 (len 4), Request who-has 192.168.0.34 tell system, length 28
19:10:36.632573 IP (tos 0x0, ttl 121, id 8699, offset 0, flags [none], proto TCP (6), length 91)
    pv-in-f100.1e100.net.https > system.49730: Flags [P.], cksum 0xc0a6 (correct), seq 1:40, ack 39, win 1041, options [nop,nop,TS val 112939235 ecr 22833817], length 39
19:10:36.673559 IP (tos 0x0, ttl 64, id 4312, offset 0, flags [DF], proto TCP (6), length 52)
    system.49730 > pv-in-f100.1e100.net.https: Flags [.], cksum 0x2f5e (correct), ack 40, win 67, options [nop,nop,TS val 22833899 ecr 112939235], length 0
19:10:36.775267 ARP, Ethernet (len 6), IPv4 (len 4), Request who-has 192.168.0.34 tell _gateway, length 46
19:10:36.775266 5c:e9:31:24:fe:df (oui Unknown) > Broadcast, Realtek unknown type 0x25
19:10:37.016567 IP (tos 0x0, ttl 64, id 15649, offset 0, flags [DF], proto TCP (6), length 52)
    system.60386 > 82.221.107.34.bc.googleusercontent.com.http: Flags [.], cksum 0x5d09 (correct), ack 425077792, win 63, options [nop,nop,TS val 2322575148 ecr 3422486186], length 0
19:10:37.016609 IP (tos 0x0, ttl 64, id 50776, offset 0, flags [DF], proto TCP (6), length 52)
    system.60368 > 82.221.107.34.bc.googleusercontent.com.http: Flags [.], cksum 0x67a5 (correct), ack 3302337447, win 63, options [nop,nop,TS val 1872300783 ecr 308740726], length 0
19:10:37.055504 IP (tos 0x0, ttl 121, id 30420, offset 0, flags [none], proto TCP (6), length 52)
    82.221.107.34.bc.googleusercontent.com.http > system.60386: Flags [.], cksum 0xd0f4 (correct), ack 1, win 1050, options [nop,nop,TS val 3422496425 ecr 2322534246], length 0
19:10:37.056070 IP (tos 0x0, ttl 122, id 41651, offset 0, flags [none], proto TCP (6), length 52)
    82.221.107.34.bc.googleusercontent.com.http > system.60368: Flags [.], cksum 0xdbc2 (correct), ack 1, win 1050, options [nop,nop,TS val 308750966 ecr 1872259830], length 0
19:10:37.528556 IP (tos 0x0, ttl 64, id 34857, offset 0, flags [DF], proto TCP (6), length 52)
    system.57140 > ta1-tsa.webex.com.https: Flags [.], cksum 0x2afb (correct), ack 2149564192, win 58, options [nop,nop,TS val 603886804 ecr 2246166788], length 0
19:10:37.528595 IP (tos 0x0, ttl 64, id 17847, offset 0, flags [DF], proto TCP (6), length 52)
    system.57152 > ta1-tsa.webex.com.https: Flags [.], cksum 0xe778 (correct), ack 2177018041, win 58, options [nop,nop,TS val 100749464 ecr 2246167247], length 0
19:10:37.604633 IP (tos 0x0, ttl 246, id 16496, offset 0, flags [DF], proto TCP (6), length 52)
    ta1-tsa.webex.com.https > system.57140: Flags [.], cksum 0x57f9 (correct), ack 1, win 4577, options [nop,nop,TS val 2246177028 ecr 603794991], length 0
19:10:37.604633 IP (tos 0x0, ttl 246, id 21021, offset 0, flags [DF], proto TCP (6), length 52)
    ta1-tsa.webex.com.https > system.57152: Flags [.], cksum 0x15c6 (correct), ack 1, win 4292, options [nop,nop,TS val 2246177486 ecr 100657602], length 0
19:10:37.656520 ARP, Ethernet (len 6), IPv4 (len 4), Request who-has 192.168.0.34 tell system, length 28
19:10:37.797074 5c:e9:31:24:fe:df (oui Unknown) > Broadcast, Realtek unknown type 0x25
19:10:37.899215 ARP, Ethernet (len 6), IPv4 (len 4), Request who-has 192.168.0.34 tell _gateway, length 46
19:10:38.206487 ARP, Ethernet (len 6), IPv4 (len 4), Request who-has 192.168.0.33 tell _gateway, length 46
19:10:38.718551 5c:e9:31:24:fe:df (oui Unknown) > Broadcast, Realtek unknown type 0x25
19:10:38.868776 IP (tos 0x0, ttl 255, id 35923, offset 0, flags [none], proto UDP (17), length 71)
    system.mdns > mdns.mcast.net.mdns: 0 PTR (QM)? 34.0.168.192.in-addr.arpa. (43)
19:10:38.925659 ARP, Ethernet (len 6), IPv4 (len 4), Request who-has 192.168.0.34 tell _gateway, length 46
19:10:39.089278 IP (tos 0x0, ttl 64, id 37845, offset 0, flags [none], proto UDP (17), length 67)
    system.58274 > _gateway.domain: 28081+ [1au] HTTPS? github.com. (39)
19:10:39.090191 IP (tos 0x0, ttl 64, id 32242, offset 0, flags [none], proto UDP (17), length 67)
    system.49442 > _gateway.domain: 8968+ [1au] A? github.com. (39)
19:10:39.116727 IP (tos 0x0, ttl 64, id 0, offset 0, flags [DF], proto UDP (17), length 141)
    _gateway.domain > system.58274: 28081 0/1/1 (113)
19:10:39.116728 IP (tos 0x0, ttl 64, id 0, offset 0, flags [DF], proto UDP (17), length 83)
    _gateway.domain > system.49442: 8968 1/0/1 github.com. A 20.29.134.23 (55)
19:10:39.122502 IP (tos 0x0, ttl 64, id 50112, offset 0, flags [DF], proto TCP (6), length 60)
    system.46108 > 20.29.134.23.https: Flags [S], cksum 0x7df8 (correct), seq 4055168864, win 64240, options [mss 1460,sackOK,TS val 3233158256 ecr 0,nop,wscale 10], length 0
19:10:39.124917 IP (tos 0x0, ttl 64, id 51585, offset 0, flags [DF], proto TCP (6), length 60)
    system.46118 > 20.29.134.23.https: Flags [S], cksum 0x1140 (correct), seq 930471074, win 64240, options [mss 1460,sackOK,TS val 199297778 ecr 0,nop,wscale 10], length 0
19:10:39.163801 IP (tos 0x0, ttl 50, id 0, offset 0, flags [DF], proto TCP (6), length 60)
    20.29.134.23.https > system.46108: Flags [S.], cksum 0x68ef (correct), seq 3115168118, ack 4055168865, win 65535, options [mss 1436,sackOK,TS val 2914252584 ecr 3233158256,nop,wscale 10], length 0
19:10:39.163895 IP (tos 0x0, ttl 64, id 50113, offset 0, flags [DF], proto TCP (6), length 52)
    system.46108 > 20.29.134.23.https: Flags [.], cksum 0x973d (correct), ack 1, win 63, options [nop,nop,TS val 3233158298 ecr 2914252584], length 0
19:10:39.164126 IP (tos 0x0, ttl 49, id 0, offset 0, flags [DF], proto TCP (6), length 60)
    20.29.134.23.https > system.46118: Flags [S.], cksum 0x96a2 (correct), seq 266143403, ack 930471075, win 65535, options [mss 1436,sackOK,TS val 1135287138 ecr 199297778,nop,wscale 10], length 0
19:10:39.164185 IP (tos 0x0, ttl 64, id 51586, offset 0, flags [DF], proto TCP (6), length 52)
    system.46118 > 20.29.134.23.https: Flags [.], cksum 0xc4f3 (correct), ack 1, win 63, options [nop,nop,TS val 199297817 ecr 1135287138], length 0
19:10:39.170535 IP (tos 0x0, ttl 64, id 50114, offset 0, flags [DF], proto TCP (6), length 1476)
    system.46108 > 20.29.134.23.https: Flags [.], cksum 0xeada (correct), seq 1:1425, ack 1, win 63, options [nop,nop,TS val 3233158305 ecr 2914252584], length 1424
19:10:39.170588 IP (tos 0x0, ttl 64, id 50115, offset 0, flags [DF], proto TCP (6), length 692)
    system.46108 > 20.29.134.23.https: Flags [P.], cksum 0x5383 (correct), seq 1425:2065, ack 1, win 63, options [nop,nop,TS val 3233158305 ecr 2914252584], length 640
19:10:39.174353 IP (tos 0x0, ttl 64, id 51587, offset 0, flags [DF], proto TCP (6), length 1476)
    system.46118 > 20.29.134.23.https: Flags [.], cksum 0xcd63 (correct), seq 1:1425, ack 1, win 63, options [nop,nop,TS val 199297827 ecr 1135287138], length 1424
19:10:39.174390 IP (tos 0x0, ttl 64, id 51588, offset 0, flags [DF], proto TCP (6), length 692)
    system.46118 > 20.29.134.23.https: Flags [P.], cksum 0xa520 (correct), seq 1425:2065, ack 1, win 63, options [nop,nop,TS val 199297827 ecr 1135287138], length 640
19:10:39.222939 IP (tos 0x0, ttl 50, id 65489, offset 0, flags [DF], proto TCP (6), length 52)
    20.29.134.23.https > system.46108: Flags [.], cksum 0x8ee4 (correct), ack 2065, win 70, options [nop,nop,TS val 2914252643 ecr 3233158305], length 0
19:10:39.222940 IP (tos 0x0, ttl 50, id 65490, offset 0, flags [DF], proto TCP (6), length 1476)
    20.29.134.23.https > system.46108: Flags [.], cksum 0x8958 (correct), seq 1:1425, ack 2065, win 70, options [nop,nop,TS val 2914252643 ecr 3233158305], length 1424
19:10:39.223048 IP (tos 0x0, ttl 64, id 50116, offset 0, flags [DF], proto TCP (6), length 52)
    system.46108 > 20.29.134.23.https: Flags [.], cksum 0x8928 (correct), ack 1425, win 62, options [nop,nop,TS val 3233158357 ecr 2914252643], length 0
19:10:39.223145 IP (tos 0x0, ttl 50, id 65491, offset 0, flags [DF], proto TCP (6), length 1476)
    20.29.134.23.https > system.46108: Flags [P.], cksum 0x3767 (correct), seq 1425:2849, ack 2065, win 70, options [nop,nop,TS val 2914252643 ecr 3233158305], length 1424
19:10:39.223146 IP (tos 0x0, ttl 50, id 65492, offset 0, flags [DF], proto TCP (6), length 301)
    20.29.134.23.https > system.46108: Flags [P.], cksum 0x3b02 (correct), seq 2849:3098, ack 2065, win 70, options [nop,nop,TS val 2914252643 ecr 3233158305], length 249
19:10:39.223179 IP (tos 0x0, ttl 64, id 50117, offset 0, flags [DF], proto TCP (6), length 52)
    system.46108 > 20.29.134.23.https: Flags [.], cksum 0x8399 (correct), ack 2849, win 61, options [nop,nop,TS val 3233158357 ecr 2914252643], length 0
19:10:39.223202 IP (tos 0x0, ttl 64, id 50118, offset 0, flags [DF], proto TCP (6), length 52)
    system.46108 > 20.29.134.23.https: Flags [.], cksum 0x82a0 (correct), ack 3098, win 61, options [nop,nop,TS val 3233158357 ecr 2914252643], length 0
19:10:39.230512 ARP, Ethernet (len 6), IPv4 (len 4), Request who-has 192.168.0.33 tell _gateway, length 46
19:10:39.231380 IP (tos 0x0, ttl 49, id 52699, offset 0, flags [DF], proto TCP (6), length 52)
    20.29.134.23.https > system.46118: Flags [.], cksum 0xbc8f (correct), ack 2065, win 70, options [nop,nop,TS val 1135287205 ecr 199297827], length 0
19:10:39.232156 IP (tos 0x0, ttl 49, id 52700, offset 0, flags [DF], proto TCP (6), length 1476)
    20.29.134.23.https > system.46118: Flags [.], cksum 0x003b (correct), seq 1:1425, ack 2065, win 70, options [nop,nop,TS val 1135287206 ecr 199297827], length 1424
19:10:39.232233 IP (tos 0x0, ttl 64, id 51589, offset 0, flags [DF], proto TCP (6), length 52)
    system.46118 > 20.29.134.23.https: Flags [.], cksum 0xb6cc (correct), ack 1425, win 62, options [nop,nop,TS val 199297885 ecr 1135287206], length 0
19:10:39.233031 IP (tos 0x0, ttl 49, id 52701, offset 0, flags [DF], proto TCP (6), length 1476)
    20.29.134.23.https > system.46118: Flags [P.], cksum 0x7da7 (correct), seq 1425:2849, ack 2065, win 70, options [nop,nop,TS val 1135287206 ecr 199297827], length 1424
19:10:39.233032 IP (tos 0x0, ttl 49, id 52702, offset 0, flags [DF], proto TCP (6), length 300)
    20.29.134.23.https > system.46118: Flags [P.], cksum 0x21b0 (correct), seq 2849:3097, ack 2065, win 70, options [nop,nop,TS val 1135287206 ecr 199297827], length 248
19:10:39.233093 IP (tos 0x0, ttl 64, id 51590, offset 0, flags [DF], proto TCP (6), length 52)
    system.46118 > 20.29.134.23.https: Flags [.], cksum 0xb13c (correct), ack 2849, win 61, options [nop,nop,TS val 199297886 ecr 1135287206], length 0
19:10:39.233198 IP (tos 0x0, ttl 64, id 51591, offset 0, flags [DF], proto TCP (6), length 52)
    system.46118 > 20.29.134.23.https: Flags [.], cksum 0xb044 (correct), ack 3097, win 61, options [nop,nop,TS val 199297886 ecr 1135287206], length 0
19:10:39.240075 IP (tos 0x0, ttl 64, id 50119, offset 0, flags [DF], proto TCP (6), length 116)
    system.46108 > 20.29.134.23.https: Flags [P.], cksum 0x4ec2 (correct), seq 2065:2129, ack 3098, win 61, options [nop,nop,TS val 3233158374 ecr 2914252643], length 64
19:10:39.241813 IP (tos 0x0, ttl 64, id 50120, offset 0, flags [DF], proto TCP (6), length 144)
    system.46108 > 20.29.134.23.https: Flags [P.], cksum 0xe9d9 (correct), seq 2129:2221, ack 3098, win 61, options [nop,nop,TS val 3233158376 ecr 2914252643], length 92
19:10:39.245480 IP (tos 0x0, ttl 64, id 51592, offset 0, flags [DF], proto TCP (6), length 116)
    system.46118 > 20.29.134.23.https: Flags [P.], cksum 0x0452 (correct), seq 2065:2129, ack 3097, win 61, options [nop,nop,TS val 199297899 ecr 1135287206], length 64
19:10:39.246368 IP (tos 0x0, ttl 64, id 51593, offset 0, flags [DF], proto TCP (6), length 161)
    system.46118 > 20.29.134.23.https: Flags [P.], cksum 0xe01c (correct), seq 2129:2238, ack 3097, win 61, options [nop,nop,TS val 199297899 ecr 1135287206], length 109
19:10:39.279710 IP (tos 0x0, ttl 50, id 65493, offset 0, flags [DF], proto TCP (6), length 131)
    20.29.134.23.https > system.46108: Flags [P.], cksum 0xedd2 (correct), seq 3098:3177, ack 2129, win 70, options [nop,nop,TS val 2914252701 ecr 3233158374], length 79
19:10:39.279711 IP (tos 0x0, ttl 50, id 65494, offset 0, flags [DF], proto TCP (6), length 131)
    20.29.134.23.https > system.46108: Flags [P.], cksum 0xfe66 (correct), seq 3177:3256, ack 2129, win 70, options [nop,nop,TS val 2914252701 ecr 3233158374], length 79
19:10:39.279802 IP (tos 0x0, ttl 50, id 65495, offset 0, flags [DF], proto TCP (6), length 116)
    20.29.134.23.https > system.46108: Flags [P.], cksum 0xc7bd (correct), seq 3256:3320, ack 2221, win 70, options [nop,nop,TS val 2914252703 ecr 3233158376], length 64
19:10:39.281505 IP (tos 0x0, ttl 64, id 50121, offset 0, flags [DF], proto TCP (6), length 52)
    system.46108 > 20.29.134.23.https: Flags [.], cksum 0x80b1 (correct), ack 3320, win 61, options [nop,nop,TS val 3233158416 ecr 2914252701], length 0
19:10:39.281663 IP (tos 0x0, ttl 64, id 50122, offset 0, flags [DF], proto TCP (6), length 83)
    system.46108 > 20.29.134.23.https: Flags [P.], cksum 0xa465 (correct), seq 2221:2252, ack 3320, win 61, options [nop,nop,TS val 3233158416 ecr 2914252701], length 31
19:10:39.284158 IP (tos 0x0, ttl 49, id 52703, offset 0, flags [DF], proto TCP (6), length 131)
    20.29.134.23.https > system.46118: Flags [P.], cksum 0x7f06 (correct), seq 3097:3176, ack 2129, win 70, options [nop,nop,TS val 1135287258 ecr 199297899], length 79
19:10:39.284159 IP (tos 0x0, ttl 49, id 52704, offset 0, flags [DF], proto TCP (6), length 131)
    20.29.134.23.https > system.46118: Flags [P.], cksum 0x7d11 (correct), seq 3176:3255, ack 2129, win 70, options [nop,nop,TS val 1135287259 ecr 199297899], length 79
19:10:39.285775 IP (tos 0x0, ttl 64, id 51594, offset 0, flags [DF], proto TCP (6), length 52)
    system.46118 > 20.29.134.23.https: Flags [.], cksum 0xae90 (correct), ack 3255, win 61, options [nop,nop,TS val 199297939 ecr 1135287258], length 0
19:10:39.285944 IP (tos 0x0, ttl 49, id 52705, offset 0, flags [DF], proto TCP (6), length 116)
    20.29.134.23.https > system.46118: Flags [P.], cksum 0x1420 (correct), seq 3255:3319, ack 2238, win 70, options [nop,nop,TS val 1135287260 ecr 199297899], length 64
19:10:39.285945 IP (tos 0x0, ttl 49, id 52706, offset 0, flags [DF], proto TCP (6), length 76)
    20.29.134.23.https > system.46118: Flags [P.], cksum 0x5e86 (correct), seq 3319:3343, ack 2238, win 70, options [nop,nop,TS val 1135287260 ecr 199297899], length 24
19:10:39.286660 IP (tos 0x0, ttl 49, id 52707, offset 0, flags [DF], proto TCP (6), length 52)
    20.29.134.23.https > system.46118: Flags [F.], cksum 0xae54 (correct), seq 3343, ack 2238, win 70, options [nop,nop,TS val 1135287260 ecr 199297899], length 0
19:10:39.286842 IP (tos 0x0, ttl 64, id 51595, offset 0, flags [DF], proto TCP (6), length 52)
    system.46118 > 20.29.134.23.https: Flags [.], cksum 0xae34 (correct), ack 3344, win 61, options [nop,nop,TS val 199297940 ecr 1135287260], length 0
19:10:39.286968 IP (tos 0x0, ttl 64, id 51596, offset 0, flags [DF], proto TCP (6), length 76)
    system.46118 > 20.29.134.23.https: Flags [P.], cksum 0x8593 (correct), seq 2238:2262, ack 3344, win 61, options [nop,nop,TS val 199297940 ecr 1135287260], length 24
19:10:39.287020 IP (tos 0x0, ttl 64, id 51597, offset 0, flags [DF], proto TCP (6), length 52)
    system.46118 > 20.29.134.23.https: Flags [F.], cksum 0xae1b (correct), seq 2262, ack 3344, win 61, options [nop,nop,TS val 199297940 ecr 1135287260], length 0
19:10:39.326775 IP (tos 0x0, ttl 49, id 0, offset 0, flags [DF], proto TCP (6), length 40)
    20.29.134.23.https > system.46118: Flags [R], cksum 0x7b67 (correct), seq 266146747, win 0, length 0
19:10:39.326776 IP (tos 0x0, ttl 49, id 0, offset 0, flags [DF], proto TCP (6), length 40)
    20.29.134.23.https > system.46118: Flags [R], cksum 0x7b67 (correct), seq 266146747, win 0, length 0
19:10:39.362639 IP (tos 0x0, ttl 50, id 65496, offset 0, flags [DF], proto TCP (6), length 52)
    20.29.134.23.https > system.46108: Flags [.], cksum 0x8035 (correct), ack 2252, win 70, options [nop,nop,TS val 2914252785 ecr 3233158416], length 0
19:10:39.742756 5c:e9:31:24:fe:df (oui Unknown) > Broadcast, Realtek unknown type 0x25
19:10:39.947161 ARP, Ethernet (len 6), IPv4 (len 4), Request who-has 192.168.0.34 tell _gateway, length 46
19:10:40.255546 ARP, Ethernet (len 6), IPv4 (len 4), Request who-has 192.168.0.33 tell _gateway, length 46
19:10:40.766803 5c:e9:31:24:fe:df (oui Unknown) > Broadcast, Realtek unknown type 0x25
19:10:40.971240 ARP, Ethernet (len 6), IPv4 (len 4), Request who-has 192.168.0.34 tell _gateway, length 46
19:10:41.790601 5c:e9:31:24:fe:df (oui Unknown) > Broadcast, Realtek unknown type 0x25
19:10:41.995515 ARP, Ethernet (len 6), IPv4 (len 4), Request who-has 192.168.0.34 tell _gateway, length 46
19:10:50.620350 IP (tos 0x0, ttl 64, id 1929, offset 0, flags [none], proto UDP (17), length 81)
    system.44817 > _gateway.domain: 50321+ [1au] PTR? 251.0.0.224.in-addr.arpa. (53)
19:10:50.621268 IP (tos 0x0, ttl 241, id 11506, offset 0, flags [DF], proto TCP (6), length 52)
    ec2-3-233-172-61.compute-1.amazonaws.com.https > system.49128: Flags [.], cksum 0xb519 (correct), ack 2187548190, win 425, options [nop,nop,TS val 272243571 ecr 4022583040], length 0
19:10:50.624474 IP (tos 0x0, ttl 250, id 9933, offset 0, flags [none], proto TCP (6), length 52)
    server-18-238-217-18.sea90.r.cloudfront.net.https > system.56024: Flags [.], cksum 0xe935 (correct), ack 973091691, win 168, options [nop,nop,TS val 3654155990 ecr 2615065805], length 0
19:10:50.630334 IP (tos 0x0, ttl 241, id 11507, offset 0, flags [DF], proto TCP (6), length 1492)
    ec2-3-233-172-61.compute-1.amazonaws.com.https > system.49128: Flags [.], cksum 0xf79f (correct), seq 0:1440, ack 1, win 425, options [nop,nop,TS val 272243577 ecr 4022583040], length 1440
19:10:50.630447 IP (tos 0x0, ttl 64, id 10469, offset 0, flags [DF], proto TCP (6), length 52)
    system.49128 > ec2-3-233-172-61.compute-1.amazonaws.com.https: Flags [.], cksum 0xb079 (correct), ack 1440, win 53, options [nop,nop,TS val 4022583150 ecr 272243577], length 0
19:10:50.630760 IP (tos 0x0, ttl 241, id 11508, offset 0, flags [DF], proto TCP (6), length 1839)
    ec2-3-233-172-61.compute-1.amazonaws.com.https > system.49128: Flags [P.], cksum 0x7813 (incorrect -> 0x65c8), seq 1440:3227, ack 1, win 425, options [nop,nop,TS val 272243577 ecr 4022583040], length 1787
19:10:50.630805 IP (tos 0x0, ttl 64, id 10470, offset 0, flags [DF], proto TCP (6), length 52)
    system.49128 > ec2-3-233-172-61.compute-1.amazonaws.com.https: Flags [.], cksum 0xa97e (correct), ack 3227, win 52, options [nop,nop,TS val 4022583151 ecr 272243577], length 0
19:10:50.630871 IP (tos 0x0, ttl 241, id 11510, offset 0, flags [DF], proto TCP (6), length 83)
    ec2-3-233-172-61.compute-1.amazonaws.com.https > system.49128: Flags [P.], cksum 0xe8da (correct), seq 3227:3258, ack 1, win 425, options [nop,nop,TS val 272243577 ecr 4022583040], length 31
19:10:50.630896 IP (tos 0x0, ttl 64, id 10471, offset 0, flags [DF], proto TCP (6), length 52)
    system.49128 > ec2-3-233-172-61.compute-1.amazonaws.com.https: Flags [.], cksum 0xa95f (correct), ack 3258, win 52, options [nop,nop,TS val 4022583151 ecr 272243577], length 0
19:10:50.649694 IP (tos 0x0, ttl 58, id 0, offset 0, flags [DF], proto UDP (17), length 177)
    pnseab-aa-in-f14.1e100.net.https > system.45438: UDP, length 149
19:10:50.650360 IP (tos 0x2,ECT(0), ttl 64, id 0, offset 0, flags [DF], proto UDP (17), length 59)
    system.45438 > pnseab-aa-in-f14.1e100.net.https: UDP, length 31
19:10:50.654092 IP (tos 0x0, ttl 64, id 0, offset 0, flags [DF], proto UDP (17), length 109)
    _gateway.domain > system.44817: 50321 1/0/1 251.0.0.224.in-addr.arpa. PTR mdns.mcast.net. (81)
19:10:50.657274 IP (tos 0x0, ttl 64, id 53969, offset 0, flags [none], proto UDP (17), length 84)
    system.42238 > _gateway.domain: 4817+ [1au] PTR? 100.142.125.74.in-addr.arpa. (56)
19:10:50.679911 IP (tos 0x0, ttl 58, id 0, offset 0, flags [DF], proto UDP (17), length 59)
    pnseab-aa-in-f14.1e100.net.https > system.45438: UDP, length 31
19:10:50.685644 IP (tos 0x0, ttl 64, id 0, offset 0, flags [DF], proto UDP (17), length 143)
    _gateway.domain > system.42238: 4817 2/0/1 100.142.125.74.in-addr.arpa. PTR pv-in-f100.1e100.net., 100.142.125.74.in-addr.arpa. PTR ie-in-f100.1e100.net. (115)
19:10:50.694707 IP (tos 0x0, ttl 64, id 62751, offset 0, flags [none], proto UDP (17), length 83)
    system.44422 > _gateway.domain: 41603+ [1au] PTR? 82.221.107.34.in-addr.arpa. (55)
19:10:50.703835 IP (tos 0x2,ECT(0), ttl 64, id 0, offset 0, flags [DF], proto UDP (17), length 60)
    system.45438 > pnseab-aa-in-f14.1e100.net.https: UDP, length 32
19:10:50.764381 IP (tos 0x0, ttl 64, id 0, offset 0, flags [DF], proto UDP (17), length 135)
    _gateway.domain > system.44422: 41603 1/0/1 82.221.107.34.in-addr.arpa. PTR 82.221.107.34.bc.googleusercontent.com. (107)
19:10:50.767060 IP (tos 0x0, ttl 64, id 36324, offset 0, flags [none], proto UDP (17), length 82)
    system.51630 > _gateway.domain: 27822+ [1au] PTR? 86.0.243.173.in-addr.arpa. (54)
19:10:50.803793 5c:e9:31:24:fe:df (oui Unknown) > Broadcast, Realtek unknown type 0x25
19:10:50.839606 IP (tos 0x0, ttl 64, id 0, offset 0, flags [DF], proto UDP (17), length 113)
    _gateway.domain > system.51630: 27822 1/0/1 86.0.243.173.in-addr.arpa. PTR ta1-tsa.webex.com. (85)
19:10:50.841725 IP (tos 0x0, ttl 64, id 31685, offset 0, flags [none], proto UDP (17), length 82)
    system.56225 > _gateway.domain: 48733+ [1au] PTR? 33.0.168.192.in-addr.arpa. (54)
19:10:50.842159 IP (tos 0x0, ttl 255, id 43531, offset 0, flags [none], proto UDP (17), length 71)
    system.mdns > mdns.mcast.net.mdns: 0 PTR (QM)? 33.0.168.192.in-addr.arpa. (43)
19:10:50.848681 IP (tos 0x0, ttl 250, id 9934, offset 0, flags [none], proto TCP (6), length 1332)
    server-18-238-217-18.sea90.r.cloudfront.net.https > system.56024: Flags [P.], cksum 0x5226 (correct), seq 0:1280, ack 1, win 168, options [nop,nop,TS val 3654156220 ecr 2615065805], length 1280
19:10:50.848682 IP (tos 0x0, ttl 250, id 9935, offset 0, flags [none], proto TCP (6), length 83)
    server-18-238-217-18.sea90.r.cloudfront.net.https > system.56024: Flags [P.], cksum 0x380a (correct), seq 1280:1311, ack 1, win 168, options [nop,nop,TS val 3654156220 ecr 2615065805], length 31
19:10:50.848773 IP (tos 0x0, ttl 64, id 52349, offset 0, flags [DF], proto TCP (6), length 52)
    system.56024 > server-18-238-217-18.sea90.r.cloudfront.net.https: Flags [.], cksum 0xe28b (correct), ack 1280, win 36, options [nop,nop,TS val 2615066133 ecr 3654156220], length 0
19:10:50.848826 IP (tos 0x0, ttl 64, id 52350, offset 0, flags [DF], proto TCP (6), length 52)
    system.56024 > server-18-238-217-18.sea90.r.cloudfront.net.https: Flags [.], cksum 0xe26c (correct), ack 1311, win 36, options [nop,nop,TS val 2615066133 ecr 3654156220], length 0
19:10:50.856543 IP (tos 0x0, ttl 58, id 0, offset 0, flags [DF], proto UDP (17), length 1355)
    pnseab-aa-in-f14.1e100.net.https > system.45438: UDP, length 1327
19:10:50.856543 IP (tos 0x0, ttl 58, id 0, offset 0, flags [DF], proto UDP (17), length 114)
    pnseab-aa-in-f14.1e100.net.https > system.45438: UDP, length 86
19:10:50.857756 IP (tos 0x2,ECT(0), ttl 64, id 0, offset 0, flags [DF], proto UDP (17), length 64)
    system.45438 > pnseab-aa-in-f14.1e100.net.https: UDP, length 36
19:10:50.863127 IP (tos 0x0, ttl 58, id 0, offset 0, flags [DF], proto UDP (17), length 181)
    pnseab-aa-in-f14.1e100.net.https > system.45438: UDP, length 153
19:10:50.883547 IP (tos 0x2,ECT(0), ttl 64, id 0, offset 0, flags [DF], proto UDP (17), length 60)
    system.45438 > pnseab-aa-in-f14.1e100.net.https: UDP, length 32
19:10:50.896154 IP (tos 0x0, ttl 64, id 0, offset 0, flags [DF], proto UDP (17), length 177)
    _gateway.domain > system.56225: 48733 NXDomain* 0/1/1 (149)
19:10:50.896919 ARP, Ethernet (len 6), IPv4 (len 4), Request who-has 192.168.0.33 tell system, length 28
19:10:50.910531 IP (tos 0x0, ttl 64, id 10472, offset 0, flags [DF], proto TCP (6), length 1181)
    system.49128 > ec2-3-233-172-61.compute-1.amazonaws.com.https: Flags [P.], cksum 0x50dc (correct), seq 1:1130, ack 3258, win 52, options [nop,nop,TS val 4022583431 ecr 272243577], length 1129
19:10:50.924593 IP (tos 0x0, ttl 58, id 0, offset 0, flags [DF], proto UDP (17), length 58)
    pnseab-aa-in-f14.1e100.net.https > system.45438: UDP, length 30
19:10:51.014243 IP (tos 0x0, ttl 241, id 11511, offset 0, flags [DF], proto TCP (6), length 1646)
    ec2-3-233-172-61.compute-1.amazonaws.com.https > system.49128: Flags [P.], cksum 0x7752 (incorrect -> 0x6f7d), seq 3258:4852, ack 1130, win 425, options [nop,nop,TS val 272243967 ecr 4022583431], length 1594
19:10:51.014244 IP (tos 0x0, ttl 241, id 11513, offset 0, flags [DF], proto TCP (6), length 83)
    ec2-3-233-172-61.compute-1.amazonaws.com.https > system.49128: Flags [P.], cksum 0x1619 (correct), seq 4852:4883, ack 1130, win 425, options [nop,nop,TS val 272243967 ecr 4022583431], length 31
19:10:51.014340 IP (tos 0x0, ttl 64, id 10473, offset 0, flags [DF], proto TCP (6), length 52)
    system.49128 > ec2-3-233-172-61.compute-1.amazonaws.com.https: Flags [.], cksum 0x9bb8 (correct), ack 4852, win 51, options [nop,nop,TS val 4022583534 ecr 272243967], length 0
19:10:51.014392 IP (tos 0x0, ttl 64, id 10474, offset 0, flags [DF], proto TCP (6), length 52)
    system.49128 > ec2-3-233-172-61.compute-1.amazonaws.com.https: Flags [.], cksum 0x9b99 (correct), ack 4883, win 51, options [nop,nop,TS val 4022583534 ecr 272243967], length 0
19:10:51.110966 ARP, Ethernet (len 6), IPv4 (len 4), Request who-has 192.168.0.34 tell _gateway, length 46
19:10:51.266356 IP (tos 0x0, ttl 64, id 10475, offset 0, flags [DF], proto TCP (6), length 361)
    system.49128 > ec2-3-233-172-61.compute-1.amazonaws.com.https: Flags [P.], cksum 0xeeef (correct), seq 1130:1439, ack 4883, win 51, options [nop,nop,TS val 4022583786 ecr 272243967], length 309
19:10:51.361621 IP (tos 0x0, ttl 241, id 11514, offset 0, flags [DF], proto TCP (6), length 2932)
    ec2-3-233-172-61.compute-1.amazonaws.com.https > system.49128: Flags [.], cksum 0x7c58 (incorrect -> 0x2f19), seq 4883:7763, ack 1439, win 425, options [nop,nop,TS val 272244321 ecr 4022583786], length 2880
19:10:51.361691 IP (tos 0x0, ttl 64, id 10476, offset 0, flags [DF], proto TCP (6), length 52)
    system.49128 > ec2-3-233-172-61.compute-1.amazonaws.com.https: Flags [.], cksum 0x8c68 (correct), ack 7763, win 49, options [nop,nop,TS val 4022583882 ecr 272244321], length 0
19:10:51.362020 IP (tos 0x0, ttl 241, id 11516, offset 0, flags [DF], proto TCP (6), length 1492)
    ec2-3-233-172-61.compute-1.amazonaws.com.https > system.49128: Flags [.], cksum 0x85af (correct), seq 7763:9203, ack 1439, win 425, options [nop,nop,TS val 272244321 ecr 4022583786], length 1440
19:10:51.362072 IP (tos 0x0, ttl 64, id 10477, offset 0, flags [DF], proto TCP (6), length 52)
    system.49128 > ec2-3-233-172-61.compute-1.amazonaws.com.https: Flags [.], cksum 0x86c9 (correct), ack 9203, win 48, options [nop,nop,TS val 4022583882 ecr 272244321], length 0
19:10:51.362565 IP (tos 0x0, ttl 241, id 11517, offset 0, flags [DF], proto TCP (6), length 1492)
    ec2-3-233-172-61.compute-1.amazonaws.com.https > system.49128: Flags [.], cksum 0x632a (correct), seq 9203:10643, ack 1439, win 425, options [nop,nop,TS val 272244321 ecr 4022583786], length 1440
19:10:51.362632 IP (tos 0x0, ttl 64, id 10478, offset 0, flags [DF], proto TCP (6), length 52)
    system.49128 > ec2-3-233-172-61.compute-1.amazonaws.com.https: Flags [.], cksum 0x8129 (correct), ack 10643, win 47, options [nop,nop,TS val 4022583883 ecr 272244321], length 0
19:10:51.362691 IP (tos 0x0, ttl 241, id 11518, offset 0, flags [DF], proto TCP (6), length 956)
    ec2-3-233-172-61.compute-1.amazonaws.com.https > system.49128: Flags [P.], cksum 0xa4cd (correct), seq 10643:11547, ack 1439, win 425, options [nop,nop,TS val 272244321 ecr 4022583786], length 904
19:10:51.362722 IP (tos 0x0, ttl 64, id 10479, offset 0, flags [DF], proto TCP (6), length 52)
    system.49128 > ec2-3-233-172-61.compute-1.amazonaws.com.https: Flags [.], cksum 0x7da1 (correct), ack 11547, win 47, options [nop,nop,TS val 4022583883 ecr 272244321], length 0
19:10:51.561924 IP (tos 0x2,ECT(0), ttl 64, id 0, offset 0, flags [DF], proto UDP (17), length 285)
    system.54204 > pg-in-f207.1e100.net.https: UDP, length 257
19:10:51.568807 IP (tos 0x0, ttl 64, id 10480, offset 0, flags [DF], proto TCP (6), length 390)
    system.49128 > ec2-3-233-172-61.compute-1.amazonaws.com.https: Flags [P.], cksum 0x9ca9 (correct), seq 1439:1777, ack 11547, win 47, options [nop,nop,TS val 4022584089 ecr 272244321], length 338
19:10:51.568899 IP (tos 0x0, ttl 64, id 10481, offset 0, flags [DF], proto TCP (6), length 526)
    system.49128 > ec2-3-233-172-61.compute-1.amazonaws.com.https: Flags [P.], cksum 0xc794 (correct), seq 1777:2251, ack 11547, win 47, options [nop,nop,TS val 4022584089 ecr 272244321], length 474
19:10:51.604153 IP (tos 0x80, ttl 59, id 0, offset 0, flags [DF], proto UDP (17), length 86)
    pg-in-f207.1e100.net.https > system.54204: UDP, length 58
19:10:51.604876 IP (tos 0x2,ECT(0), ttl 64, id 0, offset 0, flags [DF], proto UDP (17), length 64)
    system.54204 > pg-in-f207.1e100.net.https: UDP, length 36
19:10:51.656357 IP (tos 0x0, ttl 241, id 11519, offset 0, flags [DF], proto TCP (6), length 52)
    ec2-3-233-172-61.compute-1.amazonaws.com.https > system.49128: Flags [.], cksum 0x7705 (correct), ack 2251, win 425, options [nop,nop,TS val 272244617 ecr 4022584089], length 0
19:10:51.669236 IP (tos 0x80, ttl 59, id 0, offset 0, flags [DF], proto UDP (17), length 58)
    pg-in-f207.1e100.net.https > system.54204: UDP, length 30
19:10:51.695037 IP (tos 0x0, ttl 241, id 11520, offset 0, flags [DF], proto TCP (6), length 1492)
    ec2-3-233-172-61.compute-1.amazonaws.com.https > system.49128: Flags [.], cksum 0xf5a9 (correct), seq 11547:12987, ack 2251, win 425, options [nop,nop,TS val 272244654 ecr 4022584089], length 1440
19:10:51.695109 IP (tos 0x0, ttl 64, id 10482, offset 0, flags [DF], proto TCP (6), length 52)
    system.49128 > ec2-3-233-172-61.compute-1.amazonaws.com.https: Flags [.], cksum 0x723d (correct), ack 12987, win 46, options [nop,nop,TS val 4022584215 ecr 272244654], length 0
19:10:51.695344 IP (tos 0x0, ttl 241, id 11521, offset 0, flags [DF], proto TCP (6), length 1492)
    ec2-3-233-172-61.compute-1.amazonaws.com.https > system.49128: Flags [.], cksum 0x3667 (correct), seq 12987:14427, ack 2251, win 425, options [nop,nop,TS val 272244654 ecr 4022584089], length 1440
19:10:51.695390 IP (tos 0x0, ttl 64, id 10483, offset 0, flags [DF], proto TCP (6), length 52)
    system.49128 > ec2-3-233-172-61.compute-1.amazonaws.com.https: Flags [.], cksum 0x6c9e (correct), ack 14427, win 45, options [nop,nop,TS val 4022584215 ecr 272244654], length 0
19:10:51.696500 IP (tos 0x0, ttl 241, id 11522, offset 0, flags [DF], proto TCP (6), length 1492)
    ec2-3-233-172-61.compute-1.amazonaws.com.https > system.49128: Flags [.], cksum 0xc21b (correct), seq 14427:15867, ack 2251, win 425, options [nop,nop,TS val 272244654 ecr 4022584089], length 1440
19:10:51.696567 IP (tos 0x0, ttl 64, id 10484, offset 0, flags [DF], proto TCP (6), length 52)
    system.49128 > ec2-3-233-172-61.compute-1.amazonaws.com.https: Flags [.], cksum 0x66fd (correct), ack 15867, win 44, options [nop,nop,TS val 4022584217 ecr 272244654], length 0
19:10:51.696656 IP (tos 0x0, ttl 241, id 11523, offset 0, flags [DF], proto TCP (6), length 525)
    ec2-3-233-172-61.compute-1.amazonaws.com.https > system.49128: Flags [P.], cksum 0xd421 (correct), seq 15867:16340, ack 2251, win 425, options [nop,nop,TS val 272244654 ecr 4022584089], length 473
19:10:51.696658 IP (tos 0x0, ttl 241, id 11524, offset 0, flags [DF], proto TCP (6), length 83)
    ec2-3-233-172-61.compute-1.amazonaws.com.https > system.49128: Flags [P.], cksum 0x8955 (correct), seq 16340:16371, ack 2251, win 425, options [nop,nop,TS val 272244654 ecr 4022584089], length 31
19:10:51.696697 IP (tos 0x0, ttl 64, id 10485, offset 0, flags [DF], proto TCP (6), length 52)
    system.49128 > ec2-3-233-172-61.compute-1.amazonaws.com.https: Flags [.], cksum 0x6524 (correct), ack 16340, win 44, options [nop,nop,TS val 4022584217 ecr 272244654], length 0
19:10:51.696727 IP (tos 0x0, ttl 64, id 10486, offset 0, flags [DF], proto TCP (6), length 52)
    system.49128 > ec2-3-233-172-61.compute-1.amazonaws.com.https: Flags [.], cksum 0x6505 (correct), ack 16371, win 44, options [nop,nop,TS val 4022584217 ecr 272244654], length 0
19:10:51.723543 5c:e9:31:24:fe:df (oui Unknown) > Broadcast, Realtek unknown type 0x25
19:10:51.868839 IP (tos 0x0, ttl 255, id 43897, offset 0, flags [none], proto UDP (17), length 71)
    system.mdns > mdns.mcast.net.mdns: 0 PTR (QM)? 33.0.168.192.in-addr.arpa. (43)
19:10:51.928458 ARP, Ethernet (len 6), IPv4 (len 4), Request who-has 192.168.0.33 tell system, length 28
19:10:52.109548 IP (tos 0x0, ttl 64, id 52351, offset 0, flags [DF], proto TCP (6), length 278)
    system.56024 > server-18-238-217-18.sea90.r.cloudfront.net.https: Flags [P.], cksum 0xaa11 (correct), seq 1:227, ack 1311, win 36, options [nop,nop,TS val 2615067394 ecr 3654156220], length 226
19:10:52.115980 IP (tos 0x0, ttl 64, id 52352, offset 0, flags [DF], proto TCP (6), length 241)
    system.56024 > server-18-238-217-18.sea90.r.cloudfront.net.https: Flags [P.], cksum 0x72b5 (correct), seq 227:416, ack 1311, win 36, options [nop,nop,TS val 2615067400 ecr 3654156220], length 189
19:10:52.133145 ARP, Ethernet (len 6), IPv4 (len 4), Request who-has 192.168.0.34 tell _gateway, length 46
19:10:52.144104 IP (tos 0x0, ttl 250, id 9936, offset 0, flags [none], proto TCP (6), length 52)
    server-18-238-217-18.sea90.r.cloudfront.net.https > system.56024: Flags [.], cksum 0xd6ff (correct), ack 227, win 173, options [nop,nop,TS val 3654157521 ecr 2615067394], length 0
19:10:52.148828 IP (tos 0x0, ttl 250, id 9937, offset 0, flags [none], proto TCP (6), length 52)
    server-18-238-217-18.sea90.r.cloudfront.net.https > system.56024: Flags [.], cksum 0xd631 (correct), ack 416, win 179, options [nop,nop,TS val 3654157526 ecr 2615067400], length 0
19:10:52.152374 IP (tos 0x0, ttl 250, id 9938, offset 0, flags [none], proto TCP (6), length 519)
    server-18-238-217-18.sea90.r.cloudfront.net.https > system.56024: Flags [P.], cksum 0xe267 (correct), seq 1311:1778, ack 416, win 179, options [nop,nop,TS val 3654157529 ecr 2615067400], length 467
19:10:52.152502 IP (tos 0x0, ttl 64, id 52353, offset 0, flags [DF], proto TCP (6), length 52)
    system.56024 > server-18-238-217-18.sea90.r.cloudfront.net.https: Flags [.], cksum 0xd4c5 (correct), ack 1778, win 36, options [nop,nop,TS val 2615067437 ecr 3654157529], length 0
19:10:52.157373 IP (tos 0x0, ttl 64, id 476, offset 0, flags [DF], proto TCP (6), length 438)
    system.35738 > ec2-52-203-181-60.compute-1.amazonaws.com.https: Flags [P.], cksum 0x05f3 (correct), seq 2496834155:2496834541, ack 3519826600, win 63, options [nop,nop,TS val 1805616221 ecr 2556495282], length 386
19:10:52.340788 IP (tos 0x0, ttl 241, id 44176, offset 0, flags [DF], proto TCP (6), length 52)
    ec2-52-203-181-60.compute-1.amazonaws.com.https > system.35738: Flags [.], cksum 0x3f6d (correct), ack 386, win 198, options [nop,nop,TS val 2556500174 ecr 1805616221], length 0
19:10:52.340789 IP (tos 0x0, ttl 241, id 44177, offset 0, flags [DF], proto TCP (6), length 860)
    ec2-52-203-181-60.compute-1.amazonaws.com.https > system.35738: Flags [P.], cksum 0x83b7 (correct), seq 1:809, ack 386, win 198, options [nop,nop,TS val 2556500179 ecr 1805616221], length 808
19:10:52.345537 IP (tos 0x0, ttl 64, id 477, offset 0, flags [DF], proto TCP (6), length 1357)
    system.35738 > ec2-52-203-181-60.compute-1.amazonaws.com.https: Flags [P.], cksum 0xd7c1 (correct), seq 386:1691, ack 809, win 63, options [nop,nop,TS val 1805616410 ecr 2556500179], length 1305
19:10:52.346083 IP (tos 0x0, ttl 64, id 478, offset 0, flags [DF], proto TCP (6), length 1227)
    system.35738 > ec2-52-203-181-60.compute-1.amazonaws.com.https: Flags [P.], cksum 0xa442 (correct), seq 1691:2866, ack 809, win 63, options [nop,nop,TS val 1805616410 ecr 2556500179], length 1175
19:10:52.444111 IP (tos 0x0, ttl 250, id 9939, offset 0, flags [none], proto TCP (6), length 1480)
    server-18-238-217-18.sea90.r.cloudfront.net.https > system.56024: Flags [.], cksum 0x40b7 (correct), seq 1778:3206, ack 416, win 179, options [nop,nop,TS val 3654157820 ecr 2615067437], length 1428
